book_id,title,authors,average_rating,  num_pages,publication_date,
5403,Be More Chill,Ned Vizzini,3.68,287,9/1/2005,
5404,Collected Prose: Autobiographical Writings  True Stories  Critical Essays  Prefaces  and Collaborations with Artists,Paul Auster,4.04,528,3/1/2005,
5405,Hand to Mouth: A Chronicle of Early Failure,Paul Auster,3.62,176,8/1/2003,
5406,The Book of Illusions,Paul Auster,3.85,336,9/4/2003,
5407,City of Glass: The Graphic Novel,Paul Karasik/David Mazzucchelli/Paul Auster/Art Spiegelman,3.93,144,2/3/2005,
5408,Moonraker,Ian Fleming,3.74,247,6/3/2004,
5409,Moonraker's Bride,Madeleine Brent,4.31,352,1/1/1973,
5410,Eat  Pray  Love,Elizabeth Gilbert,3.55,368,2/1/2007,
5411,Eat  Pray  Love: One Woman's Search for Everything Across Italy  India and Indonesia,Elizabeth Gilbert,3.55,13,9/1/2006,
5412,The World as Will and Representation  Vol. 1,Arthur Schopenhauer/Judith Norman/E.F.J. Payne/Alistair Welchman/Christropher Janaway,4.19,534,6/1/1966,
5413,The Schopenhauer Cure,Irvin D. Yalom,4.22,358,1/3/2006,
5414,Essays and Aphorisms,Arthur Schopenhauer/R.J. Hollingdale,4.17,240,8/26/1976,
5415,Essay on the Freedom of the Will,Arthur Schopenhauer/Konstantin Kolenda,4.15,128,5/6/2005,
5416,Schopenhauer: A Very Short Introduction,Christopher Janaway,3.81,137,2/21/2002,
5417,The Mandarins,Simone de Beauvoir/Leonard M. Friedman,4.14,752,5/3/2005,
5418,Les Mandarins: Tome 2,Simone de Beauvoir,4.2,500,6/9/1972,
5419,Die Mandarins von Paris,Simone de Beauvoir,4.14,1040,1/1/2000,
5420,The Brothers K,David James Duncan,4.38,645,6/1/1996,
5421,Where the Wild Things Are,Maurice Sendak,4.22,40,12/26/2012,
5422,野獸國 (漢聲精選世界最佳兒童圖畫書．心理成長類  #36),Maurice Sendak,4.22,36,3/1/1987,
5423,Essentials of Classic Italian Cooking,Marcella Hazan/Karin Kretschmann,4.16,704,10/27/1992,
5424,The Italians: A Full-Length Portrait Featuring Their Manners and Morals,Luigi Barzini/Joan Emerson,3.83,352,7/3/1996,
5425,Peking to Paris,Luigi  Barzini/L.P. De Castelvecchio,3.79,308,12/1/1973,
5426,The Lost Lunar Baedeker: Poems of Mina Loy,Mina Loy/Roger L. Conover,4.17,256,4/8/1997,
5427,Paris Was Yesterday  1925-1939,Janet Flanner/Irving Drutman,3.85,264,4/18/1988,
5428,Lost Boy Lost Girl,Peter Straub,3.48,368,9/28/2004,
5429,Shadowland,Peter Straub,3.91,468,3/4/2003,
5430,Ghost Story,Peter Straub,3.95,567,9/1/1989,
5431,Territoires (Le talisman des territoires  #2),Stephen King/Peter Straub/Bernard Cohen,4.01,556,10/21/2002,
5432,Floating Dragon,Peter Straub,3.84,595,8/5/2003,
5433,The Color of Water: A Black Man's Tribute to His White Mother,James   McBride,4.09,328,2/7/2006,
5434,Color: A Natural History of the Palette,Victoria Finlay,3.78,464,12/30/2003,
5435,Vincent's Colors,Vincent van Gogh/Metropolitan Museum of Art/William Lach,4.16,48,9/29/2005,
5436,Flinx's Folly (Pip & Flinx #9),Alan Dean Foster,3.94,288,9/28/2004,
5437,The Doctor's House,Ann Beattie,2.96,288,2/11/2003,
5438,Chilly Scenes of Winter,Ann Beattie,3.91,288,1/2/1991,
5439,What Life Was Like in the Realm of Elizabeth: England  AD 1533-1603 (What Life Was Like),Time-Life Books,3.72,144,5/24/1999,
5440,What Life Was Like In the Age of Chivalry: Medieval Europe  AD 800-1500 (What Life Was Like),Denise Dersin,3.77,168,5/24/1999,
5441,What Life Was Like on the Banks of the Nile: Egypt  3050-30 BC,Denise Dersin,4,192,5/24/1999,
5442,What Life Was Like at the Rebirth of Genius: Renaissance Italy  AD 1400-1550 (What Life Was Like),Richard Stapleford/Time-Life Books,4,168,9/1/1999,
5443,What Life Was Like Among Druids and High Kings: Celtic Ireland  AD 400-1200 (What Life Was Like),Robin Chapman Stacey,3.64,144,5/24/1999,
5444,What Life Was Like Amid Splendor and Intrigue: Byzantine Empire  AD 330-1453,Ellen Anker/Denise Dersin,3.68,144,5/24/1999,
5445,What Life Was Like in the Time of War and Peace: Imperial Russia  AD 1696-1917 (What Life Was Like),Time-Life Books,3.75,144,9/1/1999,
5446,What Life Was Like in the Jewel in the Crown: British India  AD 1600-1905,Time-Life Books,3.66,168,9/1/1999,
5447,Birds of America,Lorrie Moore,4.11,291,9/23/1999,
5448,Self-Help,Lorrie Moore,4.2,176,1/10/1998,
5449,Who Will Run the Frog Hospital?,Lorrie Moore,3.79,160,4/13/2004,
5450,Family Matters,Rohinton Mistry,4.02,500,11/18/2003,
5451,Tales from Firozsha Baag [Jan 01  2002] Mistry  Rohinton,Rohinton Mistry,3.94,250,1/1/2002,
5452,Without Remorse (John Clark  #1; Jack Ryan Universe Publication Order #6),Tom Clancy,4.18,750,8/1/1994,
5453,Clave Red Rabbit (Jack Ryan  #2),Tom Clancy/Enric Tremps,3.67,720,2/1/2006,
5454,Debt of Honor (Jack Ryan  #7),Tom Clancy,4.05,990,8/1/1995,
5455,The Archimedes Effect (Tom Clancy's Net Force  #10),Steve Perry/Larry Segriff/Tom Clancy/Steve Pieczenik,3.98,336,2/7/2006,
5456,Hidden Agendas (Tom Clancy's Net Force  #2),Steve Perry/Tom Clancy/Steve Pieczenik,3.76,366,10/28/1999,
5457,Marine: A Guided Tour of a Marine Expeditionary Unit (Guided Tour),Tom Clancy,3.83,336,11/1/1996,
5458,The Teeth of the Tiger (Jack Ryan Universe  #12),Tom Clancy,3.64,625,8/26/2004,
5459,Executive Orders (Jack Ryan  #8),Tom Clancy,4.06,1273,1/1/1998,
5460,State of War (Tom Clancy's Net Force  #7),Steve Perry/Tom Clancy/Steve Pieczenik/Larry Segriff,3.86,384,3/4/2003,
5461,Every Man a Tiger: The Gulf War Air Campaign (Commanders),Tom Clancy/Chuck Horner,3.75,640,12/6/2005,
5462,Wild Card (Tom Clancy's Power Plays  #8),Jerome Preisler/Tom Clancy/Martin Greenberg,3.96,352,11/2/2004,
5463,Carrier: A Guided Tour of an Aircraft Carrier (Guided Tour),Tom Clancy/Leon A. Edney,3.82,368,2/1/1999,
5464,Cloak and Dagger (Tom Clancy's Net Force Explorers  #17),John Helfers/Russell Davis/Tom Clancy/Steve Pieczenik,4,208,3/4/2003,
5465,Cybernation (Tom Clancy's Net Force  #6),Steve Perry/Tom Clancy/Steve Pieczenik,3.76,368,11/1/2001,
5466,Virtual Vandals (Tom Clancy's Net Force Explorers  #1),Diane Duane/Tom Clancy/Steve Pieczenik,4.01,192,2/1/1999,
5467,Cutting Edge (Tom Clancy's Power Plays  #6),Jerome Preisler/Tom Clancy/Martin Greenberg,3.86,432,11/5/2002,
5468,Mission of Honor (Tom Clancy's Op-Center  #9),Jeff Rovin/Tom Clancy/Steve Pieczenik,3.91,432,6/4/2002,
5469,The Bear and the Dragon (John Clark  #3),Tom Clancy,3.82,1137,8/1/2001,
5470,Breaking Point (Tom Clancy's Net Force  #4),Steve Perry/Tom Clancy/Steve Pieczenik,3.7,368,10/1/2000,
5471,Airborne: A Guided Tour Of An Airborne Task Force,Tom Clancy,3.77,326,11/1/1997,
5472,Red Rabbit (Jack Ryan  #2),Tom Clancy,3.67,640,8/26/2002,
5473,John Deere Farm Tractors: A History of the John Deere Tractor,Randy Leffingwell,4.22,192,9/1/1993,
5474,Corvette: Fifty Years,Randy Leffingwell/David Newhardt,4.06,384,10/23/2004,
5475,Tough to Tackle,Matt Christopher/Harvey Kidder,3.87,139,9/30/1987,
5476,Complete Guide to OneNote,W. Frederick Zimmerman/Chris Pratley,4.25,412,11/17/2003,
5477,The Goon Show  Volume 4: My Knees Have Fallen Off!,NOT A BOOK,5,2,4/1/1996,
5478,The Goon Show: Moriarty Where Are You?,NOT A BOOK,4.43,2,3/30/2005,
5479,The Goon Show  Volume 11: He's Fallen in the Water!,NOT A BOOK,5,2,10/2/1995,
5480,Power: Die 48 Gesetze Der Macht,Robert Greene/Birgit Brandau/Hartmut Schickert,4.18,536,10/1/2001,
5481,The Echo Maker,Richard Powers,3.38,451,10/17/2006,
5482,Power vs. Force,David R. Hawkins,4.2,341,3/5/2002,
5483,The Power of Art,Simon Schama,3.88,448,11/10/2006,
5484,Goodbye  Darkness: A Memoir of the Pacific War,William Manchester,4.18,401,4/12/2002,
5485,A World Lit Only by Fire: The Medieval Mind and the Renaissance: Portrait of an Age,William Manchester,3.85,322,6/1/1993,
5486,The Last Lion 2: Winston Spencer Churchill: Alone  1932-40,William Manchester,4.48,756,10/28/1988,
5487,The Glory and the Dream: A Narrative History of America 1932-72,William Manchester,4.43,1397,7/1/1984,
5488,The Last Lion: Winston Spencer Churchill: Visions of Glory  1874-1932,William Manchester,4.42,992,5/30/1983,
5489,The Last Lion: Winston Spencer Churchill: Visions of Glory 1874-1932,William Manchester,4.42,992,4/1/1984,
5490,Moon-Flash (Kyreol  #1-2),Patricia A. McKillip,3.74,304,3/17/2005,
5491,Harrowing the Dragon,Patricia A. McKillip,3.94,308,11/7/2006,
5492,Cygnet (Cygnet  #1-2),Patricia A. McKillip,4.07,406,3/6/2007,
5493,Solstice Wood (Winter Rose  #2),Patricia A. McKillip,3.76,278,1/2/2007,
5494,Od Magic,Patricia A. McKillip,3.98,315,6/6/2006,
5495,25 Ways to Win with People: How to Make Others Feel Like a Million Bucks,John C. Maxwell/Les Parrott III,4.11,208,6/5/2005,
5496,Winning with People Workbook,John C. Maxwell,4.22,256,9/10/2005,
5497,Thornhold (The Harpers  #16; Songs & Swords  #4),Elaine Cunningham,3.67,384,12/27/2011,
5498,The Best of the Realms: The Stories of Elaine Cunningham (Forgotten Realms: The Best of the Realms  #3),Elaine Cunningham,3.98,345,5/8/2007,
5499,Changeling Storytellers Guide,Mark  Hunter/Ian Lemke,3.36,139,8/1/1998,
5500,The Blood Wood (Earthdawn 6113),FASA Corporation/Ian Lemke/Louis J. Prosperi,3.71,152,6/1/1997,
5501,Basin and Range,John McPhee,4.19,240,4/1/1982,
5502,The Deltoid Pumpkin Seed,John McPhee,3.95,192,9/1/1992,
5503,Assembling California,John McPhee,4.17,294,2/1/1994,
5504,Qué Se Puede Esperar Cuando Se Está Esperando,Heidi Murkoff/Arlene Eisenberg,3.77,624,1/31/2006,
5505,Master of Swords (Mageverse #4),Angela Knight,4.2,294,10/3/2006,
5506,Master of the Night (Mageverse #1),Angela Knight,3.88,296,10/5/2004,
5507,Master of Wolves (Mageverse  #3),Angela Knight,4.17,294,4/4/2006,
5508,Captive Dreams,Angela Knight/Diane Whiteside,3.91,336,9/5/2006,
5509,Master of Dragons (Mageverse #5),Angela Knight,4.22,293,6/5/2007,
5510,Master of the Moon (Mageverse #2),Angela Knight,4.14,336,5/3/2005,
5511,Jane's Warlord (Warlord #1),Angela Knight,3.97,320,6/1/2004,
5512,Over The Moon (Mageverse #3.5),Angela Knight/MaryJanice Davidson/Virginia Kantra/Sunny,3.9,330,1/2/2007,
5513,Mr. and Mistress (Dynasties: The Elliotts #5),Heidi Betts,3.37,185,5/9/2006,
5514,Artesia Volume 1,Mark Smylie,3.98,192,9/20/2011,
5515,Law of Enclosures,Dale Peck,3.65,320,2/1/1997,
5516,The Drift House: The First Voyage,Dale Peck,3.65,437,11/1/2006,
5517,Through a Brazen Mirror,Delia Sherman/Cortney Skinner/Ellen Kushner,3.37,100,2/25/2015,
5518,The Porcelain Dove,Delia Sherman,3.41,416,7/1/1994,
5519,Interfictions: An Anthology of Interstitial Writing,Delia Sherman/Theodora Goss/K. Tempest Bradford/Karen Jordan Allen/Rachel Pollack/Veronica Schanoes/Mikal Trimm/Colin Greenland/Vandana Singh/Matthew Cheney/Léa Silhol/Adrián Ferrero/Holly Phillips/Catherynne M. Valente/Christopher Barzak/Leslie What/Anna Tambour/Joy Marchand/Jon Singer/Csilla Kleinheincz/Michael J. DeLuca,3.77,291,4/1/2007,
5520,The Fall of the Kings (Riverside  #3),Ellen Kushner/Delia Sherman,3.65,510,9/30/2003,
5521,Killing Time,Cynthia Harrod-Eagles,3.98,280,2/1/1999,
5522,The Tangled Thread (Morland Dynasty  #10),Cynthia Harrod-Eagles,4.32,474,9/1/1987,
5523,The Flood-Tide (Morland Dynasty  #9),Cynthia Harrod-Eagles,4.25,428,2/1/1986,
5524,The White Road (Morland Dynasty  #28),Cynthia Harrod-Eagles,4.27,480,11/1/2006,
5525,The Maiden (The Morland Dynasty  #8),Cynthia Harrod-Eagles,4.27,413,2/1/1985,
5526,The Oak Apple (Morland Dynasty  #4),Cynthia Harrod-Eagles,4.18,403,5/1/2001,
5527,The Emperor (The Morland Dynasty  #11),Cynthia Harrod-Eagles,4.28,512,8/1/1988,
5528,The Nature of the Child,Jerome Kagan,3.42,352,5/13/1994,
5529,Confessions of a Pagan Nun,Kate Horsley,3.87,191,9/10/2002,
5530,Westminster Abby,Micol Ostow,3.41,192,5/5/2005,
5531,Changelings,Anne McCaffrey/Elizabeth Ann Scarborough,3.77,320,12/26/2006,
5532,Dragon's Fire (Pern  #19),Anne McCaffrey/Todd McCaffrey,3.98,366,8/1/2006,
5533,Maelstrom,Anne McCaffrey/Elizabeth Ann Scarborough,3.88,237,1/31/2007,
5534,The Mark of the Crown (Star Wars: Jedi Apprentice  #4),Jude Watson,3.73,131,10/1/1999,
5535,The Sea,John Banville/John      Lee,3.51,0,8/15/2006,
5536,Joy Within,Joan Goldstein/Manuela Soares,4.38,144,11/15/1990,
5537,Butch/Femme,Manuela Soares/Judy Grahn/Nisa Donnelly,3.62,64,4/4/1996,
5538,Expository Writing: Mini-Lessons * Strategies * Activities,Tara McCarthy/Drew Hires/Jaime Lucero/Vincent Ceci,4.33,88,4/1/1998,
5539,Persuasive Writing: Mini-Lessons  Strategies  Activities,Tara MacCarthy/Drew Hires,3.2,64,8/1/1998,
5540,McDougal Littell Science: Student Edition Grade 6 Earth Science 2006,McDougal Littell/Douglas W. Carnine,2,972,4/12/2005,
5541,Daisy Bates: Civil Rights Crusader from Arkansas,Grif Stockley,3.55,340,10/18/2005,
5542,The Loftier Way: Tales from the Ancient American Frontier,Blaine M. Yorgason/Brenton G. Yorgason,3.78,131,12/28/1985,
5543,A Higher Justice (The Trials of Kit Shannon #5),James Scott Bell,4.26,303,9/1/2003,
5544,Plot & Structure: Techniques and Exercises for Crafting a Plot That Grips Readers from Start to Finish,James Scott Bell,4.1,234,10/6/2004,
5545,Deadlock,James Scott Bell,3.96,319,10/6/2002,
5546,Breach of Promise,James Scott Bell,4,345,2/15/2004,
5547,Keats's Poetry and Prose,John Keats/Jeffrey N. Cox,4.3,673,8/1/2008,
5548,A False Mirror (Inspector Ian Rutledge  #9),Charles Todd,4.02,384,1/9/2007,
5549,Wings of Fire (Inspector Ian Rutledge  #2),Charles Todd,3.99,323,5/15/1999,
5550,A Cold Treachery (Inspector Ian Rutledge  #7),Charles Todd,4.15,416,8/30/2005,
5551,The Murder Stone,Charles Todd,3.83,416,8/31/2004,
5552,Legacy of the Dead (Inspector Ian Rutledge  #4),Charles Todd,4.15,356,6/1/2001,
5553,A Fearsome Doubt (Inspector Ian Rutledge  #6),Charles Todd,4.04,384,7/29/2003,
5554,Watchers of Time (Inspector Ian Rutledge  #5),Charles Todd,3.99,421,7/30/2002,
5555,Search the Dark (Inspector Ian Rutledge  #3),Charles Todd,4.01,310,5/15/2000,
5556,Bill Bryson's African Diary,Bill Bryson,3.44,63,12/2/2002,
5557,Hunters of Dune (Dune Chronicles  #7),Brian Herbert/Kevin J. Anderson,3.65,524,8/22/2006,
5558,The Battle Of Corrin (Legends of Dune  #3),Brian Herbert/Kevin J. Anderson,3.74,624,9/1/2004,
5559,House Corrino (Prelude to Dune #3),Brian Herbert/Kevin J. Anderson,3.68,667,8/27/2002,
5560,House Harkonnen (Prelude to Dune #2),Brian Herbert/Kevin J. Anderson,3.67,733,8/28/2001,
5561,Doctor Who: The Inside Story,Gary Russell,4.22,256,10/26/2006,
5562,Doctor Who Short Trips: Repercussions,Gary Russell/Peter Anghelides/J. Shaun Lyon/Jon de Burgh Miller/Eddie Robson/Todd Green/Andy Russell/Andrew Collins/Kathryn Sullivan/Iain McLaughlin/Mark Michalowski/Joseph Lidster/Trevor Baxendale/Colin Brake/Claire Bartlett/Sarah Groenewegen/Trey Korte/Andy Frankham-Allen,3.38,246,7/1/2004,
5563,Gerontius,James Hamilton-Paterson,3.74,272,4/17/2002,
5564,Hellstrom's Hive,Frank Herbert,3.69,312,3/23/1982,
5565,The Dark City (Eliot Ness  #1),Max Allan Collins,3.88,233,8/1/2005,
5566,Bullet Proof (Eliot Ness  #3),Max Allan Collins,3.98,197,12/20/2005,
5567,The Penguin Companion to European Literature,Anthony Thorlby,4.5,907,5/30/1969,
5568,West To Eden,Gloria Goldreich,3.77,501,12/1/1988,
5569,The Various,Steve Augarde,3.71,448,11/8/2005,
5570,Truman Capote: In Which Various Friends  Enemies  Acquaintances  and Detractors Recall His Turbulent Career,George Plimpton,4.08,498,11/10/1998,
5571,The Burnt Orange Heresy,Charles Willeford,3.9,144,12/20/1999,
5572,Ewan McGregor: From Junkie to Jedi,Brian J. Robb,2.8,144,5/5/1999,
5573,Shadow Twin,Gardner Dozois/George R.R. Martin/Daniel Abraham,3.57,114,6/1/2005,
5574,Der Prophet,Kahlil Gibran,4.23,95,9/1/2001,
5575,Le prophète,Kahlil Gibran,4.23,172,10/8/2002,
5576,The Complete Stories of Robert Louis Stevenson: Strange Case of Dr. Jekyll and Mr. Hyde and Nineteen Other Tales,Robert Louis Stevenson/Barry Menikoff,4.13,818,10/8/2002,
5577,The Complete Short Stories Of Robert Louis Stevenson: With A Selection Of The Best Short Novels,Robert Louis Stevenson/Charles Neider,4.21,720,8/22/1998,
5578,A Child's Garden of Verses,Robert Louis Stevenson/Tasha Tudor,4.3,67,2/1/1999,
5579,Have Space Suit—Will Travel,Robert A. Heinlein,3.9,276,2/8/2005,
5580,Practicalities,Marguerite Duras/Barbara Bray,3.98,143,10/22/1993,
5581,Le ravissement de Lol V. Stein,Marguerite Duras,3.66,192,6/25/1976,
5582,India Song,Marguerite Duras/Barbara Bray,3.57,146,1/13/1994,
5583,Clown,Quentin Blake,3.98,32,9/15/1998,
5584,The Spiral Stair (Arabel and Mortimer  #6),Joan Aiken/Quentin Blake,4.33,62,8/1/2000,
5585,A Near Thing for Captain Najork (Captain Najork #2),Russell Hoban/Quentin Blake,4.18,32,10/1/2006,
5586,Cover Her Face (Adam Dalgliesh #1),P.D. James/Neville Teller/Robin Ellis/Sian Phillips/Hugh Grant,3.93,2,5/7/2002,
5587,Reptiles and Amphibians (Smithsonian Handbooks),Mark O'Shea/Tim Halliday/Jonathan Metcalf,4,256,10/1/2002,
5588,The Camera (Ansel Adams Photography  #1),Ansel Adams/Robert Hardy Baker,4.16,195,6/1/1995,
5589,The Negative (Ansel Adams Photography  #2),Ansel Adams/Robert Hardy Baker,4.4,265,6/1/1995,
5590,The Print (Ansel Adams Photography  #3),Ansel Adams/Robert Hardy Baker,4.37,203,6/1/1995,
5591,The Changing Status of the Artist,Emma Barker/Nick Webb/Kim W. Woods,3.93,260,3/1/1999,
5592,Vicars of Christ: A History of the Popes,Charles A. Coulombe,3.94,492,7/1/2003,
5593,The Big Bing: Black Holes of Time Management  Gaseous Executive Bodies  Exploding Careers  and Other Theories on the Origins of the Business Universe,Stanley Bing,3.11,368,1/3/2006,
5594,What Would Machiavelli Do?: The Ends Justify the Meanness,Stanley Bing,3.45,176,7/28/2004,
5595,William James: In the Maelstrom of American Modernism,Robert D. Richardson Jr.,4.25,622,11/9/2006,
5596,Cliffs Notes on Wright's Black Boy,Carl Senna/CliffsNotes/Richard Wright,3.75,56,5/5/1971,
5597,The Wit and Wisdom of Abraham Lincoln: A Book of Quotations,Abraham Lincoln/Bob Blaisdell,4.15,96,8/8/2005,
5598,Speeches and Writings 1832–1858,Abraham Lincoln/Don E. Fehrenbacher,4.36,898,10/1/1989,
5599,Selected Speeches and Writings,Abraham Lincoln/Gore Vidal,4.22,515,2/18/1992,
5600,George Eliot: The Last Victorian,Kathryn  Hughes,4.05,416,7/2/2001,
5601,The Mill on the Floss,George Eliot/A.S. Byatt,3.79,579,2/27/2003,
5602,Scenes of Clerical Life,George Eliot/Thomas A. Noble,3.78,310,1/24/2002,
5603,Terry Jones' Medieval Lives,Terry Jones/Alan Ereira,4.02,240,5/5/2005,
5604,Terry Jones' Fairy Tales,Terry Jones/Michael Foreman,4.25,160,6/1/1993,
5605,Some Ether,Nick Flynn,4.16,85,5/1/2000,
5606,Tin House: Evil (Volume 8 no. 3),Chris Adrian/Nick Flynn/Francine Prose/Josip Novakovich/Moonshine,3.9,224,4/6/2007,
5607,A Note Slipped Under the Door: Teaching from Poems We Love,Nick Flynn/Shirley McPhillips/Philippa Stratton,4.12,256,1/1/2000,
5608,The Trouble with Testosterone and Other Essays on the Biology of the Human Predicament,Robert M. Sapolsky,4.11,288,4/24/1998,
5609,Monkeyluv: And Other Essays on Our Lives as Animals,Robert M. Sapolsky,4.17,209,10/10/2006,
5610,Literary Criticism  Vol. 1: Essays on Literature / American Writers / English Writers,Henry James/Leon Edel/Mark Wilson,4.26,1504,12/1/1984,
5611,Advanced Statistics Demystified,Larry J. Stephens,4,324,6/7/2004,
5612,Lilly's Big Day,Kevin Henkes,4.2,40,3/28/2006,
5613,Chester's Way,Kevin Henkes,4.22,32,9/22/1997,
5614,Julius  the Baby of the World,Kevin Henkes,4.28,32,9/21/1995,
5615,Forms of Talk,Erving Goffman,3.81,344,3/1/1981,
5616,Interaction Ritual - Essays on Face-to-Face Behavior,Erving Goffman,4.05,288,1/12/1982,
5617,Study Bible: NIV,Anonymous,4.7,2198,10/1/2002,
5618,My Lord Eternity (Immortal Rogues  #2),Debbie Raleigh/Alexandra Ivy,3.73,256,10/1/2003,
5619,Aesop's Fables,Aesop/Ann McGovern,4.05,80,11/1/1963,
5620,Once A Wolf: How Wildlife Biologists Fought to Bring Back the Gray Wolf,Stephen R. Swinburne/Jim Brandenburg,4.06,48,2/26/2001,
5621,Conversations with Don DeLillo,Don DeLillo/Thomas DePietro,4.06,183,1/13/2005,
5622,Inventing America: Jefferson's Declaration of Independence,Garry Wills,3.93,432,11/14/2002,
5623,Lincoln at Gettysburg: The Words That Remade America,Garry Wills,4.14,320,11/14/2006,
5624,Venice: Lion City: The Religion of Empire,Garry Wills,3.76,416,9/3/2002,
5625,Four Weddings and a Funeral,Richard Curtis,3.75,128,4/15/1996,
5626,Halloween,Richard Curtis,4.13,166,9/1/1982,
5627,Janet  My Mother and Me: A Memoir of Growing Up with Janet Flanner and Natalia Danesi Murray,William Murray,3.5,320,2/17/2000,
5628,Catch That Pass!,Matt Christopher,3.91,130,9/1/1989,
5629,Divide and Conquer (Tom Clancy's Op-Center  #7),Jeff Rovin/Tom Clancy/Steve Pieczenik,3.8,372,6/12/2000,
5630,Death Match (Tom Clancy's Net Force Explorers  #18),Diane Duane/Tom Clancy/Steve Pieczenik,4.17,192,7/1/2003,
5631,Line of Control (Tom Clancy's Op-Center  #8),Jeff Rovin/Tom Clancy/Steve Pieczenik,3.86,384,6/5/2001,
5632,Sea of Fire (Tom Clancy's Op-Center  #10),Jeff Rovin/Tom Clancy/Steve Pieczenik,3.89,400,6/24/2003,
5633,One is the Loneliest Number (Tom Clancy's Net Force Explorers  #3),Diane Duane/Tom Clancy/Steve Pieczenik,3.95,182,4/1/1999,
5634,Aliens: Nightmare Asylum,Steve Perry,3.67,277,4/1/1993,
5635,The Omega Cage (Matador  #4),Steve Perry/Michael Reaves,3.78,256,4/1/1988,
5636,The 97th Step (Matador  #5),Steve Perry,4.22,304,12/1/1989,
5637,A Friar's Bloodfeud (Knights Templar  #20),Michael Jecks,4.1,500,6/5/2006,
5638,Death Ship of Dartmouth (Knights Templar  #21),Michael Jecks,4.06,352,6/1/2006,
5639,The John Deere Two-Cylinder Tractor Encyclopedia: The Complete Model-by-Model History,Don Macmillan/Wayne G. Broehl Jr.,4.75,256,5/15/2007,
5640,Phantoms,Rosalind M. Greenberg,3.38,270,4/4/1989,
5641,Fantasy Gone Wrong,Martin H. Greenberg/Brittiany A. Koren/Brian Stableford/Mickey Zucker Reichert/Fiona Patton/Jim C. Hines/Esther M. Friesner/Donald J. Bingle/Alan Dean Foster/Devon Monk/Phaedra M. Weldon/Christina F. York/Jana Paniccia/Josepha Sherman/Susan Sizemore/Michael Jasper/Janny Wurts/Lisanne Norman,3.45,309,9/5/2006,
5642,The Ghosts in Baker Street: New Tales of Sherlock Holmes,Martin H. Greenberg/Daniel Stashower,3.58,320,1/9/2006,
5643,Christmas Bestiary,Martin H. Greenberg/Jack Nimersheim/Jane Yolen/Jack C. Haldeman II/Harry Turtledove/Laura Resnick/Mike Resnick/Karen Haber/Jane Lindskold/Lawrence Schimel/Barry N. Malzberg/Tanya Huff/Michelle Sagara West/Mark Aronson/Stefan R. Dziemianowicz/Jennifer Roberson/Kristine Kathryn Rusch/Elizabeth Ann Scarborough/Barbara Delaplace/Barb Jernigan/Blake Cahoon,3.62,315,11/3/1992,
5644,Black Cats and Broken Mirrors,John Helfers/Esther M. Friesner/Nina Kiriki Hoffman/Bruce Holland Rogers/Peter Crowther/R. Davis/Charles de Lint/Elizabeth Ann Scarborough/Michelle Sagara West/Nancy Springer/Dean Wesley Smith/Kristine Kathryn Rusch/Josepha Sherman/Jane Lindskold/Genevieve Gorman/Kristin Schwengel/Jean-François Podevin/Zane Stillings/Carol Rondou,3.38,320,6/1/1998,
5645,Time Twisters,Jean Rabe/Martin H. Greenberg/Stephen Leigh/Gene DeWeese/Joe Masdon/Donald J. Bingle/Skip Williams/Penny Williams/Pierce Askegren/Nancy Virginia Varian/Wes Nicholson/John Helfers/Chris Pierson/Harry Turtledove/Kevin J. Anderson/Robert E. Vardeman/Jackie Cassada/James M. Ward/Jon L. Breen/Linda P. Baker,3.36,306,1/2/2007,
5646,The Western Canon: The Books and School of the Ages,Harold Bloom,3.86,546,9/1/1995,
5647,Shakespeare: The Invention of the Human,Harold Bloom,4.02,745,9/1/1999,
5648,The American Religion,Harold Bloom,3.76,305,10/1/2006,
5649,American Caesar: Douglas MacArthur 1880-1964,William Manchester,4.15,811,9/30/1978,
5650,Winchester Shotguns,Dennis Adler/R.L. Wilson,5,372,5/15/2008,
5651,Colossians and Philemon: A Critical and Exegetical Commentary (International Critical Commentary),R. McL. Wilson,5,512,12/7/2005,
5652,Maurice Sendak's Seven Little Monsters: What Time is It? - Book #4,Arthur Yorinks/Raymond Jafelice,2.75,24,4/5/2004,
5653,Meditations for Manifesting: Morning and Evening Meditations to Literally Create Your Heart's Desire,Wayne W. Dyer,4.02,1,6/1/1995,
5654,There's a Spiritual Solution to Every Problem,Wayne W. Dyer,4.27,288,8/21/2001,
5655,Michael Smith Elements of Style,Michael S.  Smith/Diane Dorrans Saeks,4.17,212,11/22/2005,
5656,Spares,Michael Marshall Smith,4.13,317,11/2/1998,
5657,One of Us,Michael Marshall Smith,4.04,368,7/6/1999,
5658,The Secret City (Pyrates  #1),Chris Archer,4.11,184,2/1/2003,
5659,The Theory and Practice of Group Psychotherapy,Irvin D. Yalom/Molyn Leszcz,4.17,688,7/6/2005,
5660,When Nietzsche Wept,Irvin D. Yalom,4.32,310,1/4/2005,
5661,Existential Psychotherapy,Irvin D. Yalom,4.39,544,12/8/1980,
5662,Crown of Stars (Crown of Stars  #7),Kate Elliott,3.91,609,1/2/2007,
5663,Crown Duel (Crown & Court #1-2),Sherwood Smith,4.19,471,6/10/2002,
5664,A Rose for the Crown,Anne Easter Smith,4.02,650,3/14/2006,
5665,The Bloody Crown of Conan (Conan the Cimmerian  #2),Robert E. Howard/Gary Gianni/Patrice Louinet,4.3,366,11/23/2004,
5666,Rough Crossings: Britain  the Slaves and the American Revolution,Simon Schama,3.98,496,4/25/2006,
5667,Landscape and Memory,Simon Schama,4.17,672,11/5/1996,
5668,The Embarrassment of Riches: An Interpretation of Dutch Culture in the Golden Age,Simon Schama,4.06,720,12/8/1997,
5669,Citizens: A Chronicle of the French Revolution,Simon Schama,3.99,825,8/5/2004,
5670,The Feelings Book: The Care & Keeping of Your Emotions,Lynda Madison/Bonnie Timmons/Norm Bendell,4.16,104,9/1/2002,
5671,A Smart Girl's Guide to Money: How to Make It  Save It  And Spend It,Nancy Holyoke/Ali Douglass,4.14,95,3/1/2006,
5672,What Would You Do? (American Girl Library),Patti Kelley Criswell/Norm Bendell,4.26,63,7/1/2004,
5673,The Halloween Activity Book: Creepy  Crawly  Hairy  Scary Things to Do,Mymi Doinet/Benjamin Chaud,2,32,8/1/2002,
5674,The Capricorn Stone,Madeleine Brent,3.91,346,5/12/1983,
5675,Golden Urchin,Madeleine Brent,4.09,384,11/12/1987,
5676,The Ethics of Ambiguity,Simone de Beauvoir/Bernard Frechtman,4.15,162,6/1/2000,
