book_id,title,authors,average_rating,  num_pages,publication_date,
2671,The View From Castle Rock,Alice Munro,3.68,368,11/19/2008,
2672,Crossing to Safety,Wallace Stegner/Terry Tempest Williams/T.H. Watkins,4.16,368,4/9/2002,
2673,Oh Rats! The Story of Rats and People,Albert Marrin/C.B. Mordan,3.77,48,8/17/2006,
2674,King Rat (Asian Saga  #4),James Clavell,4.14,368,5/19/2009,
2675,Rat Bastards: The Life and Times of South Boston's Most Honorable Irish Mobster,"John ""Red"" Shea/Mark Wahlberg",3.51,304,3/14/2006,
2676,Julius Knipl  Real Estate Photographer: The Beauty Supply District,Ben Katchor,4.35,120,8/12/2003,
2677,Blind Willow  Sleeping Woman: 24 Stories,Haruki Murakami/Ellen Archer/Patrick Lawlor,3.84,0,10/15/2006,
2678,Blind Willow  Sleeping Woman,Haruki Murakami/Philip Gabriel/Jay Rubin,3.84,333,8/29/2006,
2679,The Bookseller of Kabul,Åsne Seierstad/Ingrid Christopherson,3.77,288,10/26/2004,
2680,Jasmine and Stars: Reading More Than Lolita in Tehran,Fatemeh Keshavarz,3.63,174,3/5/2007,
2681,Making Globalization Work,Joseph E. Stiglitz,3.85,384,9/17/2006,
2682,Prep : A Novel,Curtis Sittenfeld,3.38,420,11/22/2005,
2683,Tan fuerte  tan cerca,Jonathan Safran Foer,3.98,457,9/30/2005,
2684,The Wizard of Oz,Salman Rushdie/Richard Maltby/Melvyn Bragg,4,69,5/27/1992,
2685,The Ground Beneath Her Feet,Salman Rushdie,3.79,576,3/16/2000,
2686,The Moor's Last Sigh,Salman Rushdie,3.93,434,7/4/1996,
2687,Los Versos Satánicos,Salman Rushdie,3.71,679,8/30/2003,
2688,Dangling Man,Saul Bellow/Salman Rushdie,3.54,191,10/1/1996,
2689,Grimus,Salman Rushdie,3.41,320,9/30/2003,
2690,Breakfast at Tiffany's,Truman Capote,3.89,157,9/3/1998,
2691,Jesus' Son,Denis Johnson,4.09,192,1/23/2007,
2692,Angels,Denis Johnson,3.72,209,3/6/2003,
2693,The Throne of the Third Heaven of the Nations Millennium General Assembly: Poems Collected and New,Denis Johnson,4.15,225,1/1/1996,
2694,The Stars at Noon,Denis Johnson,3.58,192,5/30/2000,
2695,The Rules of Attraction,Bret Easton Ellis,3.68,283,6/30/1998,
2696,Glamorama,Bret Easton Ellis,3.46,546,3/21/2000,
2697,Less Than Zero,Bret Easton Ellis,3.58,208,6/9/2010,
2698,A Christmas Memory,Truman Capote,4.24,48,10/10/2006,
2699,In Cold Blood,Truman Capote/Bob Colacello,4.07,343,3/5/2002,
2700,The Southern Haunting of Truman Capote,James C.    Simmons/Marie Rudisill,3.9,135,10/1/2000,
2701,Summer Crossing,Truman Capote,3.44,142,9/28/2006,
2702,Answered Prayers,Truman Capote,3.49,192,10/25/2001,
2703,The Grass Harp  Including A Tree of Night and Other Stories,Truman Capote,4.01,272,9/28/1993,
2704,From Babylon to Timbuktu: A History of the Ancient Black Races Including the Black Hebrews,Rudolph R. Windsor/El Hagahn,4.31,151,8/25/2006,
2705,Cruelest Journey: Six Hundred Miles To Timbuktu,Kira Salak,3.93,320,11/1/2004,
2706,Between Time and Timbuktu or Prometheus-5,Kurt Vonnegut Jr.,3.46,304,7/15/1972,
2707,Murder in Amsterdam: The Death of Theo van Gogh and the Limits of Tolerance,Ian Buruma,3.72,288,9/7/2006,
2708,The Cement Garden,Ian McEwan,3.54,144,8/5/2004,
2709,Atonement,Ian McEwan,3.9,372,5/2/2002,
2710,Gertrud The Great Of Helfta: Spiritual Exercises,Gertrude the Great/Gertrud Jaron Lewis,3.43,165,11/1/1989,
2711,Gertrud,Hermann Hesse,3.85,180,1/1/1983,
2712,Der Prozess,Franz Kafka,3.98,0,5/5/1988,
2713,Naokos Lächeln,Haruki Murakami/Ursula Gräfe,4.03,416,2/1/2003,
2714,The Ruined Map,Kōbō Abe/E. Dale Saunders,3.55,304,12/4/2001,
2715,The Face of Another,Kōbō Abe/E. Dale Saunders,3.78,238,2/4/2003,
2716,Three Plays: Involuntary Homicide / The Green Stockings / The Ghost is Here,Kōbō Abe/Donald Keene,3.91,233,3/1/1997,
2717,Secret Rendezvous,Kōbō Abe/Juliet Winters Carpenter,3.61,192,7/9/2002,
2718,Oracle Night,Paul Auster,3.78,245,12/2/2003,
2719,Eleanor Rigby,Douglas Coupland,3.65,272,5/30/2006,
2720,Homo Faber,Max Frisch,3.74,228,5/1/1994,
2721,Erläuterungen Zu Max Frisch  Homo Faber,Bernd Matzkowski,3.6,104,5/11/2002,
2722,Homo faber: Ein Bericht.,Max Frisch,3.74,298,1/1/1995,
2723,The Philosophy of Jean-Paul Sartre,Jean-Paul Sartre,3.89,512,5/27/2003,
2724,Being and Nothingness,Jean-Paul Sartre/Hazel E. Barnes/Mary Warnock/Richard Eyre,3.96,688,8/28/2003,
2725,The Age of Reason,Jean-Paul Sartre,3.98,408,7/7/1992,
2726,Die Entdeckung der Langsamkeit,Sten Nadolny,3.95,358,3/28/1999,
2727,Youth in Revolt: The Journals of Nick Twisp,C.D. Payne,4.02,512,1/1/2001,
2728,And I Don't Want to Live This Life: A Mother's Story of Her Daughter's Murder,Deborah Spungen,4.1,408,9/29/1996,
2729,Sid and Nancy: Love Kills,Alex Cox/Abbe Wool,3.48,143,12/31/1986,
2730,Flags of Our Fathers,James D. Bradley/Ron Powers,4.19,382,8/29/2006,
2731,Flags of Our Fathers: A Young People's Edition,Michael R. French/Ron Powers/James D. Bradley,4.17,224,8/1/2006,
2732,A Long Way Down,Nick Hornby,3.42,368,5/2/2006,
2733,Clockwork (Cover to Cover),Philip Pullman,3.87,0,7/29/2002,
2734,Mary Queen of Scots,Antonia Fraser,4.05,568,9/1/1993,
2735,Mary Queen of Scots and the Murder of Lord Darnley,Alison Weir,4.04,640,2/5/2004,
2736,On the Trail of Mary  Queen of Scots,J. Keith Cheetham,3.25,192,6/1/1999,
2737,River of Blue Fire (Otherland  #2),Tad Williams,4.02,675,9/1/1999,
2738,Mary  Queen of Scots: Queen Without a Country,Kathryn Lasky,3.83,202,5/1/2002,
2739,Mountain of Black Glass (Otherland  #3),Tad Williams,4.05,749,9/12/2000,
2740,Mary  Queen of Scots: Pride  Passion and a Kingdom Lost,Jenny Wormald,3.72,224,5/4/2001,
2741,Queen of Scots: The True Life of Mary Stuart,John Guy,3.93,581,4/7/2004,
2742,The Last Wife of Henry VIII,Carolly Erickson,3.89,326,10/3/2006,
2743,The Children of Henry VIII,Alison Weir,4.05,385,7/8/1997,
2744,The Last Days of Henry VIII,Robert Hutchinson,4.14,368,9/20/2005,
2745,The Autobiography of Henry VIII: With Notes by His Fool  Will Somers,Margaret George,4.26,939,9/15/1998,
2746,Henry VIII (Shakespeare  Pelican),William Shakespeare/Stephen Orgel,3.54,126,8/1/2001,
2747,The Memoirs of Cleopatra,Margaret George,4.18,1139,1/10/1998,
2748,Saint George and the Dragon,Margaret Hodges/Trina Schart Hyman,4.18,32,9/4/1990,
2749,Kiss Me Like a Stranger: My Search for Love and Art,Gene Wilder,3.9,261,3/7/2006,
2750,Wie ich eines schönen Morgens im April das 100%ige Mädchen sah,Haruki Murakami/Nora Bierich,3.8,218,8/1/1998,
2751,The Complete Sherlock Holmes  Volume I,Arthur Conan Doyle/Kyle Freeman,4.49,709,9/1/2003,
2752,The Complete Sherlock Holmes  Volume II,Arthur Conan Doyle/Kyle Freeman,4.47,709,10/1/2003,
2753,The Last of Her Kind,Sigrid Nunez,3.72,391,12/12/2006,
2754,Anatomy of Love: A Natural History of Mating  Marriage  and Why We Stray,Helen Fisher,3.94,432,1/3/1994,
2755,The Devil's in the Details (A Camilla MacPhee Mystery  #4),Mary Jane Maffini,4,320,10/1/2004,
2756,Wigfield: The Can-Do Town That Just May Not,Amy Sedaris/Stephen Colbert/Paul Dinello,3.58,5,5/19/2004,
2757,The SantaLand Diaries and Season's Greetings,David Sedaris/Joe Mantello,4.18,54,12/1/1998,
2758,Jenny and the Jaws of Life: Short Stories,Jincy Willett/David Sedaris,3.74,272,9/14/2002,
2759,Venac sonetnih venaca; Puževa srma,Dobrica Erić,0,222,1/1/1996,
2760,View With a Grain of Sand: Selected Poems,Wisława Szymborska/Stanisław Barańczak/Clare Cavanagh,4.33,214,5/26/1995,
2761,View with a Grain of Sand: Selected Poems,Wisława Szymborska,4.33,214,10/23/1996,
2762,Poems New and Collected,Wisława Szymborska/Clare Cavanagh,4.43,296,11/16/2000,
2763,Sounds  Feelings  Thoughts:  Seventy Poems by Wislawa Szymborska,Wisława Szymborska/Magnus J. Kruyski,4.36,232,8/21/1981,
2764,Miracle Fair: Selected Poems,Wisława Szymborska/Joanna Trzeciak/Czesław Miłosz,4.42,159,11/17/2002,
2765,Jane Eyre,Charlotte Brontë/Michael Mason,4.12,532,2/4/2003,
2766,The Far Pavilions,M.M. Kaye,4.21,0,12/12/1988,
2767,Death in Kashmir,M.M. Kaye,3.95,256,12/1/2000,
2768,The Sun in the Morning: My Early Years in India and England,M.M. Kaye,4.22,454,9/1/1990,
2769,Death in the Andamans,M.M. Kaye,3.93,272,2/11/2000,
2770,Death in Berlin,M.M. Kaye,3.89,272,6/8/2000,
2771,The Far Pavilions,M.M. Kaye,4.21,958,1/15/1997,
2772,Enchanted Evening,M.M. Kaye,4.38,368,12/5/2000,
2773,Pathologies of Power: Health  Human Rights and the New War on the Poor,Paul Farmer/Amartya Sen,4.25,438,11/22/2004,
2774,Infections and Inequalities: The Modern Plagues,Paul Farmer,4.09,424,2/23/2001,
2775,Mountains Beyond Mountains: The Quest of Dr. Paul Farmer  a Man Who Would Cure the World,Tracy Kidder,4.21,333,8/31/2004,
2776,The Tao of Physics: An Exploration of the Parallels between Modern Physics and Eastern Mysticism,Fritjof Capra,3.97,366,1/4/2000,
2777,Dr. Mary's Monkey: How the Unsolved Murder of a Doctor  a Secret Laboratory in New Orleans and Cancer-Causing Monkey Viruses are Linked to Lee Harvey Oswald  the JFK Assassination and Emerging Global Epidemics,Edward T. Haslam/Jim Marrs,3.92,374,4/1/2007,
2778,The Art of Richard P. Feynman,Michelle Feynman,4.31,174,7/1/1995,
2779,The Early History of God: Yahweh and the Other Deities in Ancient Israel,Mark S. Smith/Patrick D. Miller,4.03,243,8/28/2002,
2780,Haiti  History  and the Gods,Joan Dayan/Colin Dayan,3.95,362,3/10/1998,
2781,Acts of God: The Unnatural History of Natural Disaster in America,Ted Steinberg,3.72,309,6/1/2006,
2782,The World's Religions,Huston Smith,4.07,416,9/13/1991,
2783,Introduction to World Religions,Christopher Partridge,3.78,495,3/24/2005,
2784,FDR's Folly: How Roosevelt and His New Deal Prolonged the Great Depression,Jim  Powell,4,352,9/28/2004,
2785,Folly and Glory (The Berrybender Narratives  #4),Larry McMurtry,3.87,358,8/8/2005,
2786,The Argumentative Indian: Writings on Indian History  Culture and Identity,Amartya Sen,3.8,432,9/5/2006,
2787,Argumentative Indian: Writings On Indian History Culture And Identity,Amartya Sen,3.8,391,6/28/2005,
2788,Things to Bring  S#!t to Do: And Other Inventories of Anxiety: My Life in Lists,Karen Rizzo,3.67,160,10/1/2006,
2789,Dumpy's Valentine,Julie Andrews Edwards/Emma Walton Hamilton/Tony Walton/Ruby Randig,3.31,24,12/12/2006,
2790,Mandy,Julie Andrews Edwards/Johanna Westerman,4.24,320,8/15/2006,
2791,Giraffes Can't Dance,Giles Andreae/Guy Parker-Rees/Hugh Laurie,4.3,32,6/1/2006,
2792,The Medici Giraffe and Other Tales of Exotic Animals and Power,Marina Belozerskaya,3.53,414,8/21/2006,
2793,The Giraffe Who Was Afraid of Heights (Physical & Behavioral Adaptation),David A. Ufer/Kirsten Carlson,3.87,32,6/1/2006,
2794,Where the Red Fern Grows with Connections,Wilson Rawls/Rafe Martin/Borden Deal/Kemp P. Battle/Robert Bethke/Harold Courlander/Maya Angelou/Nicholasa Mohr/Dick Perry/John R. Erickson,4.37,288,9/1/1998,
2795,Summer of the Monkeys,Wilson Rawls,4.03,288,12/29/1998,
2796,Dreams from My Father: A Story of Race and Inheritance,Barack Obama,3.88,442,1/9/2007,
2797,Doctor Who: Cat's Cradle-Time's Crucible,Marc Platt,3.22,275,2/20/1992,
2798,Doctor Who: Cat's Cradle-Witch Mark,Andrew    Hunt,3.22,256,6/18/1992,
2799,Doctor Who: Cat's Cradle-Warhead,Andrew Cartmel,3.51,262,4/16/1992,
2800,He's Just Not That Into You: The No-Excuses Truth to Understanding Guys,Greg Behrendt/Liz Tuccillo,3.66,208,12/26/2006,
2801,Do Not Open This Book,Michaela Muntean/Pascal Lemaître,3.9,40,3/1/2006,
2802,Not Your Mother's Slow Cooker Cookbook,Beth Hensperger/Julie Kaufmann,3.78,520,12/21/2004,
2803,Hands Are Not for Hitting (Ages 4-7),Martine Agassi/Marieka Heinlen,4.04,35,2/1/2001,
2804,Not So Big House,Sarah Susanka/Kira Obolensky,4.07,208,4/20/2001,
2805,Rodinsky's Room,Rachel Lichtenstein/Iain Sinclair,3.85,362,2/1/2000,
2806,The Rough Guide to Cuba 3,Fiona McAuslan/Matthew  Norman,3.82,640,6/20/2005,
2807,Cuba: A New History,Richard Gott,4.06,384,11/11/2005,
2808,Cuba 15,Nancy Osa,3.45,304,3/8/2005,
2809,Cuba (Jake Grafton #7),Stephen Coonts,3.82,461,5/15/2000,
2810,The Memory Keeper's Daughter,Kim Edwards,3.67,401,5/30/2006,
2811,Too Far to Go: The Maples Stories,John Updike,4.02,256,6/12/1982,
2812,Far to Go (Margaret Thursday  #2),Noel Streatfeild,3.81,161,2/1/1986,
2813,The Children on the Top Floor,Noel Streatfeild,3.79,180,7/1/1985,
2814,Desolation Angels,Jack Kerouac/Joyce Johnson,3.93,432,9/1/1995,
2815,Healing With Whole Foods: Asian Traditions and Modern Nutrition,Paul Pitchford,4.41,784,11/5/2002,
2816,The New Whole Foods Encyclopedia: A Comprehensive Resource for Healthy Eating,Rebecca  Wood/Paul Pitchford,4.2,464,7/1/1999,
2817,The Discomfort Zone: A Personal Journey,Jonathan Franzen,3.4,6,8/28/2006,
2818,The Parrot's Lament  and Other True Tales of Animal Intrigue  Intelligence  and Ingenuity,Eugene Linden,3.93,224,8/1/2000,
2819,Postscript to the Name of the Rose,Umberto Eco,4.05,84,1/1/1984,
2820,El nombre de la rosa,Umberto Eco,4.12,782,2/28/2006,
2821,Baby Names for Dummies,Margaret  Rose/Heather Rose Jones,3.32,364,5/1/2005,
2822,The Mysterious Flame of Queen Loana,Umberto Eco/Geoffrey Brock,3.35,480,6/5/2006,
2823,History of Beauty,Umberto Eco/Girolamo De Michele/Alastair McEwen/Agnolo di Cosimo Bronzino,3.78,432,11/13/2004,
2824,Baudolino,Umberto Eco/William Weaver/R.C.S. Libri,3.74,527,10/6/2003,
2825,Travels in Hyperreality,Umberto Eco/John Radziewicz/William Weaver,3.89,324,5/27/1990,
2826,How to Travel with a Salmon and Other Essays,Umberto Eco/William Weaver,3.85,256,9/15/1995,
2827,A Theory of Semiotics,Umberto Eco,4.01,368,2/1/1978,
2828,Art and Beauty in the Middle Ages,Umberto Eco/Hugh Bredin,3.99,144,2/8/2002,
2829,Mouse or Rat?: Translation as Negotiation,Umberto Eco,3.8,208,9/28/2004,
2830,The Role of the Reader: Explorations in the Semiotics of Texts,Umberto Eco,4.06,288,7/22/1979,
2831,Libraries,Candida Höfer/Umberto Eco,4.28,271,8/20/2014,
2832,The Art of War,Sun Tzu/Thomas Cleary/Pulat Otkan/Giray Fidan,3.97,273,1/11/2005,
2833,Sun Tzu: The Art of War for Managers; 50 Strategic Rules,Sun Tzu/Gerald A. Michaelson,3.8,224,1/1/2001,
2834,The Art of War,Sun Tzu/Ralph D. Sawyer,3.97,5,6/1/2003,
2835,The Lost Continent:  Travels in Small-town America,Bill Bryson,3.83,379,1/2/1999,
2836,Made in America: An Informal History of the English Language in the United States,Bill Bryson,3.91,364,10/23/2001,
2837,Ulysses,James Joyce/Declan Kiberd,3.73,933,3/30/2000,
2838,The Long-Lost Map (Ulysses Moore #2),Pierdomenico Baccalario/Iacopo Bruno/Leah D. Janeczko,4,272,7/1/2006,
2839,The Wicked Wit of Charles Dickens,Shelley Klein/Charles Dickens,3.55,162,9/1/2002,
2840,The Three Musketeers,Alexandre Dumas/Barbara T. Cooper,4.07,761,11/25/2004,
2841,The Three Musketeers,Alexandre Dumas/Michael Page,4.07,24,7/25/2005,
2842,The Three Musketeers (Great Illustrated Classics),Malvina G. Vogel/Alexandre Dumas,4.08,236,12/3/2005,
2843,The Three Musketeers (The d'Artagnan Romances. #1),Alexandre Dumas/Keith Wren,4.07,592,5/5/2001,
2844,Lisey's Story,Stephen King,3.68,513,10/24/2006,
2845,King Arthur Flour Whole Grain Baking: Delicious Recipes Using Nutritious Whole Grains,King Arthur Flour,4.13,544,10/9/2006,
2846,King Dork (King Dork  #1),Frank Portman,3.56,344,4/11/2006,
2847,A Clash of Kings  (A Song of Ice and Fire  #2),George R.R. Martin,4.41,969,5/28/2002,
2848,The Colorado Kid,Stephen King,3.32,178,2/20/2006,
2849,Stationary Bike,Stephen King/Ron McLarty,3.54,44,7/1/2006,
2850,Everything's Eventual: 14 Dark Tales,Stephen King,3.97,605,11/1/2005,
2851,The Mist,Stephen King/ZBS Foundation,3.95,2,9/1/1993,
2852,Pet Sematary,Stephen King,3.98,576,11/1/2005,
2853,Insomnia,Stephen King/Bettina Blanch Tyroller,3.82,890,2/28/2005,
2854,The Stephen King Collection: Stories from Night Shift,Stephen King/John  Glover,4,11,2/8/2005,
2855,The Man in the Black Suit: 4 Dark Tales,Stephen King/Ana Juan/John Cullum/Becky Ann Baker/Íñigo Jáuregui/Peter Gerety/Arliss Howard,3.78,128,11/1/2002,
2856,The Shining,Stephen King/Campbell Scott,4.22,16,8/2/2005,
2857,Stephen King: America's Best-Loved Boogeyman,George Beahm,3.78,304,5/1/1998,
2858,The Illustrated Stephen King Trivia Book,Brian James Freeman/Bev Vincent/Glenn Chadbourne,4.23,404,5/1/2005,
2859,Gray Matter and Other Stories from Night Shift,Stephen King/John  Glover,3.93,0,8/1/1993,
2860,Cujo,Stephen King,3.71,432,6/6/2006,
2861,Thinner,Richard Bachman/Stephen King,3.71,320,9/1/1996,
2862,Stephen King from A to Z: An Encyclopedia of His Life and Work,George Beahm,3.83,251,3/31/1999,
2863,Black House (The Talisman  #2),Stephen King/Peter Straub,4.01,688,9/30/2003,
2864,The Stephen King Universe: A Guide to the Worlds of the King of Horror,Stanley Wiater/Christopher Golden/Hank Wagner,4.15,478,5/21/2001,
2865,Night Shift,Stephen King,4,326,2/1/1979,
2866,Misery,Stephen King,4.16,370,11/1/1988,
2867,The Bachman Books,Richard Bachman/Stephen King,4.11,704,10/1/1996,
2868,Misery,Stephen King/María Mir,4.16,368,3/26/2002,
2869,Carrie,Stephen King,3.96,253,10/1/1999,
2870,"Four Past Midnight: Featuring ""The Langoliers""",Stephen King,3.93,761,5/1/1995,
2871,Christine,Stephen King/Marie Milpois,3.77,411,6/13/2001,
2872,Sam Walton: Made In America,Sam Walton/John Huey,4.15,346,6/1/1993,
2873,The Road to Reality: A Complete Guide to the Laws of the Universe,Roger Penrose,4.11,1099,1/9/2007,
2874,The Paradox of Choice: Why More Is Less,Barry Schwartz,3.85,265,1/18/2005,
2875,Coach: Lessons on the Game of Life,Michael   Lewis,3.82,96,4/17/2005,
2876,Losers: The Road to Everyplace But the White House,Michael   Lewis,3.87,320,7/28/1998,
2877,Next: The Future Just Happened,Michael   Lewis,3.67,240,5/17/2002,
2878,The Ends of the Earth: A Journey to the Frontiers of Anarchy,Robert D. Kaplan,4.12,496,1/28/1997,
2879,Salvation to the Ends of the Earth: A Biblical Theology of Mission (New Studies in Biblical Theology (InterVarsity Press)  #11),Andreas J. Köstenberger/Peter T. O'Brien,3.93,351,1/1/2001,
2880,The Ends Of The Earth: A Journey At The Dawn Of The 21st Century,Robert D. Kaplan,4.12,476,2/27/1996,
2881,When Genius Failed: The Rise and Fall of Long-Term Capital Management,Roger Lowenstein,4.19,264,10/9/2001,
2882,When Genius Failed: The Rise And Fall Of Long Term Capital Management,Roger Lowenstein,4.19,275,6/1/2009,
2883,The Secret of Fantasy Forest (Sweet Valley Kids #67),Francine Pascal/Molly Mia Stewart/Ying-Hwa Hu,3.94,96,9/1/1996,
2884,Pearl and Wagner: Three Secrets,Kate McMullan/Janet Allison Brown/R.W. Alley,3.84,48,5/24/2004,
2885,A History of Britain: The Fate Of Empire 1776-2000 (A History of Britain  #3),Simon Schama,4.06,576,12/18/2002,
2886,The Devil in the White City Murder  Magic and Madness at the Fair that Changed America,Erik Larson,3.99,464,3/3/2003,
2887,O Historiador,Elizabeth Kostova,3.78,544,8/19/2005,
2888,Kim,Rudyard Kipling/Jeffrey Meyers,3.72,286,12/15/2003,
2889,Birds Without Wings,Louis de Bernières,4.16,640,7/1/2004,
2890,God Knows,Joseph Heller,3.8,368,11/12/1997,
2891,Picture This,Joseph Heller,3.68,352,3/24/2000,
2892,Closing Time,Joseph Heller,3.02,464,7/1/2003,
2893,Good as Gold,Joseph Heller,3.36,445,11/12/1997,
2894,Something Happened,Joseph Heller,3.52,576,11/12/1997,
2895,Archie Americana Series: Best of the Eighties  Vol. 1,George Gladir/John L. Goldwater/Steve Geppi/Michael I. Silberkleit,3.91,96,6/26/2001,
2896,The Moviegoer,Walker Percy,3.68,242,4/14/1998,
2897,Wicked: The Life and Times of the Wicked Witch of the West,Gregory Maguire/Douglas Smith,3.53,409,3/2/2004,
2898,Wicked: Memorias de una bruja mala (Los años malvados  #1),Gregory Maguire/Claudia Conde,3.53,508,5/1/2007,
2899,The Sword and the Shield: The Mitrokhin Archive & the Secret History of the KGB,Christopher M. Andrew/Vasili Mitrokhin,3.93,736,8/29/2000,
2900,Lay Down My Sword And Shield (Hackberry Holland  #1),James Lee Burke,3.89,320,9/4/2003,
2901,Sword and Shield,John Terra,4,16,9/1/1992,
2902,A Year in the Merde,Stephen Clarke,3.54,276,5/2/2006,
2903,Merde!: The Real French You Were Never Taught at School,Geneviève/Michael    Heath,3.96,112,12/9/1998,
2904,Merde Encore!: More of the Real French You Were Never Taught at School,Geneviève/Michael    Heath,3.96,104,12/9/1998,
2905,Can't Wait to Get to Heaven,Fannie Flagg/Cassandra Campbell,3.91,384,7/18/2006,
2906,Green Hills of Africa,Ernest Hemingway/Edward Shenton,3.56,200,3/4/2004,
2907,Across the River and into the Trees,Ernest Hemingway,3.33,272,4/15/1998,
2908,Hemingway: The Paris Years,Michael S. Reynolds,4.17,402,5/17/1999,
2909,Adios Hemingway,Leonardo Padura/John King,3.72,229,3/10/2006,
2910,By-Line: Selected Articles and Dispatches of Four Decades,Ernest Hemingway/William M. White,3.96,512,5/12/1998,
2911,The Hemingway Women: Those Who Love Him - The Wives And Others,Bernice Kert,4.17,556,12/17/1998,
2912,Hemingway: A Biography,Jeffrey Meyers,4,644,5/7/1999,
2913,The Sword of Straw (The Sangreal Trilogy  #2),Amanda Hemingway,3.81,336,3/28/2006,
2914,A Farewell to Arms,Ernest Hemingway/John Slattery,3.8,8,5/1/2006,
2915,A Farewell to Arms,Ernest Hemingway,3.8,336,2/1/1982,
2916,The Big Rock Candy Mountain,Wallace Stegner,4.15,563,3/1/1991,
2917,Beyond the Hundredth Meridian: John Wesley Powell and the Second Opening of the West,Wallace Stegner/Bernard DeVoto,4.07,438,3/1/1992,
2918,Collected Stories,Wallace Stegner/Lynn Stegner,4.22,576,7/25/2006,
2919,All the Little Live Things,Wallace Stegner,4.09,345,12/1/1991,
2920,Where the Bluebird Sings to the Lemonade Springs,Wallace Stegner/T.H. Watkins,4.1,234,4/9/2002,
2921,Wallace Stegner: His Life and Work,Jackson J. Benson,4.19,496,11/1/1997,
2922,Letters of E.B. White,E.B. White/Dorothy Lobrano Guth/Martha White/John Updike,4.13,736,11/28/2006,
2923,Here Is New York,E.B. White/Roger Angell/Barbara Cohen/Judith Stonehill,4.3,58,1/1/2000,
2924,Charlotte's Web,E.B. White/Garth Williams,4.17,179,11/1/2006,
2925,Charlotte's Web,E.B. White/Garth Williams,4.17,256,10/28/1993,
2926,Che Guevara: A Revolutionary Life,Jon Lee Anderson/José Hernández/Leena Nivala,4.12,814,3/9/1998,
2927,Gatsby's Girl,Caroline Preston,3.54,312,5/1/2006,
2928,In Search of Captain Zero: A Surfer's Road Trip Beyond the End of the Road,Allan C. Weisbecker,3.89,352,9/16/2002,
2929,Pipe Dream (Strivers Row),Solomon Jones,3.97,341,7/31/2001,
2930,The Pleasure of My Company,Steve Martin,3.78,176,10/6/2004,
2931,Shopgirl,Steve Martin,3.43,130,1/1/2000,
2932,The Mutineer: Rants  Ravings  and Missives from the Mountaintop  1977-2005,Hunter S. Thompson,4.08,752,3/1/2013,
2933,Generation of Swine: Tales of Shame and Degradation in the '80's,Hunter S. Thompson,3.78,336,11/6/2003,
2934,The Gonzo Way: A Celebration of Dr. Hunter S. Thompson,Anita Thompson,3.96,112,7/1/2007,
2935,The Proud Highway: Saga of a Desperate Southern Gentleman  1955-1967,Hunter S. Thompson/Douglas Brinkley,4.14,720,4/7/1998,
2936,Einstein: His Life and Universe,Walter Isaacson,4.11,675,4/10/2007,
2937,The Wise Men: Six Friends and the World They Made,Walter Isaacson/Evan Thomas,4.07,864,6/4/1997,
2938,Kissinger,Walter Isaacson,3.94,896,9/27/2005,
2939,Traveling Mercies: Some Thoughts on Faith,Anne Lamott,4.16,275,2/15/2000,
2940,Where Rainbows End,Cecelia Ahern,3.94,454,11/8/2004,
2941,Irish Girls Are Back in Town,Cecelia Ahern/Patricia Scanlan/Gemma O'Connor/Sarah Webb/Maeve Binchy/Marian Keyes/Morag Prunty/Cathy Kelly/Colette Caddle/Marita Conlon-McKenna/Martina Devlin/Clare Dowling/Catherine Foley/Aine Greaney/Suzanne Higgins/Rosaleen Linehan/Joan O'Neill/Julie Parsons/Deirdre Purcell/Martina Reilly/Mary Ryan/Annie Sparrow/Una Brankin,3.74,384,3/1/2005,
2942,There's No Place Like Here,Cecelia Ahern,3.67,340,9/4/2007,
2943,Final Rain (The Survivalist  #19),Jerry Ahern,3.69,220,6/1/1989,
2944,The Pursuit of Happyness,Chris Gardner,4.19,320,10/24/2006,
2945,Harvesting the Heart,Jodi Picoult,3.6,453,4/1/1995,
2946,The Tenth Circle,Jodi Picoult,3.5,416,10/24/2006,
2947,Mercy,Jodi Picoult,3.58,400,4/1/2001,
2948,Picture Perfect,Jodi Picoult,3.54,369,7/2/2002,
2949,Songs of the Humpback Whale,Jodi Picoult,3.2,346,10/1/2001,
2950,Salem Falls,Jodi Picoult,3.82,434,8/1/2002,
2951,The Pact,Jodi Picoult,4.01,512,8/29/2006,
2952,My Sister's Keeper,Jodi Picoult,4.07,423,2/1/2005,
2953,Cold Mountain,Charles Frazier,3.86,356,9/1/2006,
2954,The Collected Songs of Cold Mountain,Hanshan/Red Pine/John Blofeld,4.41,320,6/1/2000,
2955,For One More Day,Mitch Albom,4.1,197,9/26/2006,
2956,Just One More Day: A Memoir,Susan    Lewis,3.98,340,1/5/2006,
2957,Ya Sé Que Te Quiero,Billy Crystal/Elizabeth Sayles,4.19,40,4/11/2006,
2958,Absolutely Mahvelous,Billy Crystal/Dick Schaap,3.79,128,7/18/1986,
2959,The Last Innocent Man,Phillip Margolin,3.91,352,1/25/2005,
2960,Outlander (Outlander  #1),Diana Gabaldon,4.23,850,7/26/2005,
2961,A Breath of Snow and Ashes (Outlander  #6),Diana Gabaldon,4.44,980,8/29/2006,
2962,Outlander - The Exile of Sharad Hett (Star Wars: Ongoing  Volume 2),Timothy Truman/Rick Leonardi/Tom Raney/Al Rio,3.43,144,4/18/2001,
2963,The Fiery Cross (Outlander  #5),Diana Gabaldon/Janos Farkas,4.27,1443,8/30/2005,
2964,Refuge (Outlanders  #36),James Axler,3.93,346,2/14/2006,
2965,Dragonfly in Amber (Outlander  #2),Diana Gabaldon,4.32,743,7/1/1992,
2966,Outlander,Matt Keefe,3.85,254,12/26/2006,
2967,Hydra's Ring (Outlanders  #39),James Axler,3.88,348,11/1/2006,
2968,Omega Path (Outlanders  #4),James Axler,3.87,352,1/23/1998,
2969,Savage Sun (Outlanders  #3),James Axler,3.84,352,10/24/1997,
2970,As I Lay Dying,William Faulkner/E.L. Doctorow,3.71,231,1/25/2001,
2971,Novels  1926-1929,William Faulkner/Noel Polk/Joseph Blotner,4.42,1180,4/6/2006,
2972,Light in August,William Faulkner,3.94,507,1/30/1991,
2973,Novels 1942–1954: Go Down  Moses / Intruder in the Dust / Requiem for a Nun / A Fable,William Faulkner/Noel Polk/Joseph Blotner,4.44,1110,10/1/1994,
2974,Selected Short Stories,William Faulkner,4.09,320,5/18/1993,
2975,Three Famous Short Novels: Spotted Horses Old Man the Bear,William Faulkner,3.86,320,2/12/1958,
